{
	"$schema": "../../schema/article.schema.json",
	"updated": "2023-08-22T13:10:35.171Z",
	"date": "2023-08-22T13:10:35.171Z",
	"issue": 15,
	"url": "https://qwq.dsy4567.icu/blog/vercel-dev-sidecar-fq/index.md?to-read-this-pls=使用境外ip访问",
	"cover": "https://qwq.dsy4567.icu/blog/vercel-dev-sidecar-fq/image/ds.png",
	"tags": ["技术", "科学上网", "Vercel"]
}
